{
  "$schema": "https://json-schema.org/draft/2020-12/schema",
  "$id": "https://github.com/iandrummond-socal/OpenPlow/schemas/finding.schema.json",
  "title": "OpenPlow finding",
  "description": "A single candidate vulnerability produced by a hunter and judged by the validator. Adapted from the Cloudflare security-audit skill's report schema.",
  "type": "object",
  "additionalProperties": false,
  "required": ["id", "verdict", "title", "attack_class", "threat_model", "location"],
  "properties": {
    "id": {
      "type": "string",
      "description": "Stable cross-run key for this finding (root-cause based, not line based)."
    },
    "verdict": {
      "type": "string",
      "enum": ["confirmed", "needs_validation", "rejected"],
      "description": "confirmed = complete source trace + bounded observed result; needs_validation = exact unresolved fact, no severity; rejected = disproved."
    },
    "title": { "type": "string", "minLength": 1 },
    "attack_class": {
      "type": "string",
      "description": "One of the attack classes from the skill's class files (e.g. web-auth, memory-safety, llm, supply-chain)."
    },
    "weakness": {
      "type": ["string", "null"],
      "description": "The hunter's own label for the weakness (e.g. 'OS command injection (CWE-78)'). attack_class is the hunt cell's class."
    },
    "severity": {
      "type": ["string", "null"],
      "enum": ["critical", "high", "medium", "low", "info", null],
      "description": "Impact = likelihood x impact. Null unless verdict is confirmed."
    },
    "threat_model": {
      "type": "object",
      "additionalProperties": false,
      "required": ["attacker", "boundary"],
      "properties": {
        "attacker": { "type": "string", "description": "Who the attacker is and what they control." },
        "boundary": { "type": "string", "description": "The trust boundary crossed." }
      }
    },
    "location": {
      "type": "object",
      "additionalProperties": false,
      "required": ["file"],
      "properties": {
        "file": { "type": "string", "description": "Repo-relative path, must exist." },
        "line": { "type": ["integer", "null"], "minimum": 1 },
        "symbol": { "type": ["string", "null"] }
      }
    },
    "description": { "type": "string" },
    "poc": {
      "type": ["object", "null"],
      "additionalProperties": false,
      "description": "A proof of concept that runs against the UNTOUCHED codebase. Absent/failing PoC => finding is treated as fake.",
      "properties": {
        "kind": { "type": "string", "enum": ["test", "script", "input", "trace"] },
        "path": { "type": ["string", "null"] },
        "content": { "type": ["string", "null"] },
        "observed": { "type": ["string", "null"], "description": "The bounded result observed when run." }
      }
    },
    "patch": {
      "type": ["string", "null"],
      "description": "Proposed git diff that fixes the finding."
    },
    "validation": {
      "type": ["object", "null"],
      "additionalProperties": false,
      "description": "Filled by the adversarial validator; never by the finder.",
      "properties": {
        "checked_by": { "type": "string" },
        "served_by": { "type": ["string", "null"], "description": "Model id that wrote the validator's verdict (a fallback model if the request was refused)." },
        "disproof_attempted": { "type": "boolean" },
        "notes": { "type": "string" },
        "poc_attempted": { "type": "boolean", "description": "Whether the finding's PoC was run in the sandbox." },
        "poc_demonstrated": { "type": "boolean", "description": "Whether the PoC reproduced the bug against the untouched copy." },
        "poc_reason": { "type": "string", "description": "Why a PoC did not count (timeout, tampering, did not reproduce); empty when it did." },
        "poc_enforced": {
          "type": "object",
          "additionalProperties": { "type": "boolean" },
          "description": "Which sandbox protections were active for the PoC run (e.g. seccomp, readonly_fs, memory_cap). Empty means the backend claimed none."
        }
      }
    },
    "provenance": {
      "type": "object",
      "additionalProperties": false,
      "required": ["run_id", "repo", "stage"],
      "properties": {
        "run_id": { "type": "string" },
        "repo": { "type": "string" },
        "stage": { "type": "string" },
        "finder_model": { "type": ["string", "null"] },
        "served_by": {
          "type": ["string", "null"],
          "description": "Model id that wrote the hunter's final answer; differs from finder_model when a refused request fell back to another model."
        },
        "task_id": { "type": ["string", "null"] }
      }
    }
  }
}
